{
  "evaluation_record_id": "scenario-001-eval-01",
  "project_id": "clixsy-oracle-agent",
  "created_at": "2026-04-08T20:45:00Z",
  "subject": "Synthetic evaluation of scenario-001 recommendation based on outcome record",
  "related_recommendation_ids": [
    "scenario-001-rec-01"
  ],
  "related_outcome_record_ids": [
    "scenario-001-outcome-01"
  ],
  "related_evidence_bundle_ids": [
    "scenario-001-bundle-01"
  ],
  "evaluation_result": "partially_successful",
  "evaluation_summary": "The fixture demonstrates clear contract-chain traceability, but recommendation effectiveness remains only partially established because execution behavior is intentionally out of scope.",
  "confidence": {
    "level": "medium",
    "rationale": "Evaluation is grounded in linked synthetic artifacts with known limits from absent runtime implementation."
  },
  "unknowns": [
    "Whether real runtime behavior would preserve the same artifact completeness and linkage quality."
  ],
  "notes": "Synthetic example only. Not client data and not MarketBrew production evaluation."
}
